<?xml version="1.0" encoding="UTF-8"?>
<tariffs xmlns:xsi="http://www.w3.org/2001/XMLSchema-instance" xsi:schemaLocation="http://www.task3.tasks/tariffs tariffs.xsd">

<tariff>
<name tariffID="asdf1234">Dlya dzvinkiv</name>
<operatorName>Kievstar</operatorName>
<payroll>52</payroll>
<callPrices>
<insideNetwork>4.5</insideNetwork>
<outsideNetwork>4.6</outsideNetwork>
<landLinePhone>4.7</landLinePhone>
</callPrices>
<smsPrice>1.3</smsPrice>
<parameters>
<favouriteNumber count="2">
<number>12345634</number>
<number>123456344</number>
</favouriteNumber>
<tariffication>minute1</tariffication>
<connectionCost>0.24</connectionCost>
</parameters>

</tariff>

<tariff>

<name tariffID="asdf1235">Dlya smartfona extra</name>
<operatorName>Kievstar</operatorName>
<payroll>51</payroll>
<callPrices>
<insideNetwork>4.2</insideNetwork>
<outsideNetwork>4.3</outsideNetwork>
<landLinePhone>4.4</landLinePhone>
</callPrices>
<smsPrice>1.2</smsPrice>
<parameters>
<favouriteNumber count="1">
<number>12345634</number>
</favouriteNumber>
<tariffication>seconds12</tariffication>
<connectionCost>0.23</connectionCost>
</parameters>

</tariff>
</tariffs>